{
  "$schema": "http://json-schema.org/draft-07/schema#",
  "$id": "https://github.com/USERNAME/cctv-camera-database/schema/camera.schema.json",
  "title": "CCTV Camera",
  "description": "Schema for a single CCTV / IP camera entry.",
  "type": "object",
  "required": [
    "id",
    "brand",
    "model",
    "type",
    "resolution"
  ],
  "additionalProperties": false,
  "properties": {
    "id": {
      "type": "string",
      "description": "Unique slug, e.g. 'reolink-duo-2'.",
      "pattern": "^[a-z0-9]+(-[a-z0-9]+)*$"
    },
    "brand": {
      "type": "string"
    },
    "model": {
      "type": "string"
    },
    "aliases": {
      "type": "array",
      "items": {
        "type": "string"
      },
      "description": "Alternate names / SKUs."
    },
    "type": {
      "type": "string",
      "enum": [
        "bullet",
        "dome",
        "turret",
        "ptz",
        "dual-lens",
        "fisheye",
        "covert",
        "box",
        "panoramic",
        "floodlight",
        "doorbell"
      ]
    },
    "connectivity": {
      "type": "array",
      "items": {
        "type": "string",
        "enum": [
          "wifi",
          "ethernet",
          "4g",
          "5g",
          "coax"
        ]
      },
      "description": "Network connectivity only \u2014 how the camera sends data."
    },
    "power_source": {
      "type": "array",
      "items": {
        "type": "string",
        "enum": [
          "poe",
          "dc",
          "usb",
          "battery",
          "solar",
          "ac-mains"
        ]
      },
      "description": "How the camera is powered."
    },
    "resolution": {
      "type": "object",
      "required": [
        "megapixels"
      ],
      "additionalProperties": false,
      "properties": {
        "megapixels": {
          "type": "number"
        },
        "max_width": {
          "type": "integer"
        },
        "max_height": {
          "type": "integer"
        },
        "label": {
          "type": "string",
          "description": "e.g. '4K', '1080p'."
        }
      }
    },
    "video": {
      "type": "object",
      "description": "Stream capabilities — what the camera outputs (codecs, FPS, per-stream specs). This is spec metadata; the RTSP URLs to actually use live under configs.frigate.* (rtsp_url_template, best_substream). Optional and backfilled opportunistically.",
      "additionalProperties": false,
      "properties": {
        "codecs": {
          "type": "array",
          "items": {
            "type": "string",
            "enum": ["H.264", "H.264+", "H.265", "H.265+", "MJPEG", "JPEG", "AV1", "Ultra265", "MPEG-4"]
          },
          "description": "Supported video codecs, e.g. ['H.265', 'H.264', 'MJPEG']. Normalise branded/profile variants (Smart H.265+, H.264H, M-JPEG, h264) to this canonical enum."
        },
        "max_fps": {
          "type": "integer",
          "description": "Max FPS at highest resolution."
        },
        "streams": {
          "type": "array",
          "items": {
            "type": "object",
            "properties": {
              "name": {
                "type": "string",
                "description": "e.g. 'main', 'sub', 'third'."
              },
              "resolution": {
                "type": "string",
                "description": "e.g. '3840x2160'."
              },
              "fps": {
                "type": "integer"
              },
              "codec": {
                "type": "string",
                "enum": ["H.264", "H.264+", "H.265", "H.265+", "MJPEG", "JPEG", "AV1", "Ultra265", "MPEG-4"]
              }
            }
          },
          "description": "Per-stream capability breakdown (name/resolution/fps/codec) — what each stream outputs. Distinct from configs.frigate.best_substream, which is the RTSP URL to use."
        }
      }
    },
    "sensor": {
      "type": "string",
      "description": "e.g. '1/2.7\" CMOS'."
    },
    "lens": {
      "type": "object",
      "additionalProperties": false,
      "properties": {
        "count": {
          "type": "integer"
        },
        "focal_length_mm": {
          "type": "string"
        },
        "aperture": {
          "type": "string"
        },
        "varifocal": {
          "type": "boolean"
        }
      }
    },
    "field_of_view_deg": {
      "type": "string"
    },
    "night_vision": {
      "type": "object",
      "additionalProperties": false,
      "properties": {
        "type": {
          "type": "string",
          "enum": [
            "ir",
            "color",
            "hybrid",
            "none"
          ]
        },
        "range_m": {
          "type": "integer"
        },
        "min_lux": {
          "type": "number",
          "minimum": 0,
          "description": "Minimum illumination (lux) required for usable image."
        },
        "min_lux_color": {
          "type": "number",
          "minimum": 0,
          "description": "Minimum illumination (lux) required for color image."
        }
      }
    },
    "ptz": {
      "type": "object",
      "additionalProperties": false,
      "description": "PTZ capabilities (pan/tilt/zoom cameras). Camera-side autotracking is distinct from Frigate autotracking (configs.frigate.autotracking), which additionally requires ONVIF relative movement.",
      "properties": {
        "autotracking": {
          "type": "boolean",
          "description": "Camera-side (onboard) subject autotracking — the camera moves itself to follow a subject."
        },
        "onvif_ptz": {
          "type": "string",
          "description": "ONVIF PTZ movement model the camera exposes. Frigate autotracking requires 'relative'; e.g. Reolink is 'absolute' only.",
          "enum": [
            "relative",
            "absolute",
            "continuous",
            "none"
          ]
        }
      }
    },
    "power": {
      "type": "object",
      "additionalProperties": false,
      "properties": {
        "method": {
          "type": "string"
        },
        "consumption_w": {
          "type": "number"
        },
        "voltage": {
          "type": "string"
        },
        "poe_class": {
          "type": "integer",
          "enum": [0, 1, 2, 3, 4, 5, 6, 7, 8],
          "description": "PoE class (e.g. 3 for PoE Class 3)."
        }
      }
    },
    "storage": {
      "type": "object",
      "additionalProperties": false,
      "properties": {
        "onboard": {
          "type": "boolean"
        },
        "max_microsd_gb": {
          "type": "integer"
        },
        "nvr_compatible": {
          "type": "boolean"
        },
        "cloud": {
          "type": "boolean"
        },
        "notes": {
          "type": "string",
          "description": "Free-text storage notes, e.g. external hub requirement."
        }
      }
    },
    "protocols": {
      "type": "array",
      "items": {
        "type": "string",
        "enum": [
          "onvif",
          "rtsp",
          "rtmp",
          "http",
          "p2p",
          "hdcvi",
          "mxpeg"
        ]
      }
    },
    "ip_rating": {
      "type": "string",
      "description": "e.g. 'IP66', 'IP67'."
    },
    "ik_rating": {
      "type": "string",
      "enum": ["IK00", "IK01", "IK02", "IK03", "IK04", "IK05", "IK06", "IK07", "IK08", "IK09", "IK10", "IK11"],
      "description": "IEC 622262 Mechanical Impact Protection. e.g. IK10."
    },
    "audio": {
      "type": "object",
      "additionalProperties": false,
      "properties": {
        "microphone": {
          "type": "boolean"
        },
        "speaker": {
          "type": "boolean"
        },
        "two_way": {
          "type": "boolean"
        }
      }
    },
    "features": {
      "type": "array",
      "items": {
        "type": "string"
      },
      "description": "e.g. 'person detection', 'vehicle detection', 'auto-tracking'."
    },
    "operating_temp_c": {
      "type": "string"
    },
    "dimensions_mm": {
      "type": "string"
    },
    "weight_g": {
      "type": "number"
    },
    "release_year": {
      "type": "integer"
    },
    "end_of_sale_year": {
      "type": "integer"
    },
    "end_of_support_year": {
      "type": "integer"
    },
    "environment": {
      "type": "array",
      "items": {
        "type": "string",
        "enum": ["indoor", "outdoor"]
      },
      "description": "Indoor and/or outdoor suitability."
    },
    "soc": {
      "type": "string",
      "description": "System on Chip (SoC), e.g. Ingenic T31 (for Thingino/OpenIPC compatibility)."
    },
    "ndaa_compliant": {
      "type": "boolean",
      "description": "True if the camera is NDAA-compliant (Section 889 — no Hikvision/Dahua/HiSilicon etc. components), as stated by the manufacturer. Omit when unknown; never infer."
    },
    "cloud_dependency": {
      "type": "string",
      "enum": ["local", "cloud-optional", "cloud-required"],
      "description": "Whether the camera needs a vendor cloud/app to function: 'local' = operates fully locally (ONVIF/RTSP or NVR) with no vendor cloud needed; 'cloud-optional' = works locally but the vendor also offers an app/cloud; 'cloud-required' = mandates a vendor cloud/app (no usable local stream). Distinct from storage.cloud (which only means cloud storage is supported). Omit when unverifiable; never guess."
    },
    "markets": {
      "type": "array",
      "items": {
        "type": "string"
      },
      "description": "Regions/countries where the camera is sold, e.g. ['EU', 'DE', 'MENA', 'global']."
    },
    "generation": {
      "type": "string",
      "description": "Product generation/line, e.g. 'Wisenet 9'."
    },
    "release_notes": {
      "type": "string",
      "description": "Free-text notes about the release (launch events, pending specs, etc.)."
    },
    "community_notes": {
      "type": "array",
      "description": "Observed behaviors and quirks reported by users. NOT from the datasheet, NOT verified by the project. Never use this for spec corrections.",
      "items": {
        "type": "object",
        "additionalProperties": false,
        "required": ["note", "source", "reported_by", "date"],
        "properties": {
          "note": {
            "type": "string",
            "minLength": 20,
            "maxLength": 600,
            "description": "One observed behavior, stated plainly. What happens, under what condition."
          },
          "category": {
            "type": "string",
            "enum": ["rtsp", "onvif", "firmware", "audio", "ptz", "power", "network", "frigate", "home_assistant", "blue_iris", "other"],
            "description": "Rough topic bucket for filtering/rendering."
          },
          "firmware": {
            "type": "string",
            "description": "Firmware version this was observed on, if known. E.g. 'V5.7.3 build 230801'."
          },
          "source": {
            "type": "string",
            "description": "URL to the thread/issue/video where this is documented, or the literal string 'empirical' if the reporter tested it on their own device.",
            "anyOf": [
              { "format": "uri" },
              { "const": "empirical" }
            ]
          },
          "reported_by": {
            "type": "string",
            "description": "GitHub username or handle of the person who reported it.",
            "pattern": "^[A-Za-z0-9_.-]{1,64}$"
          },
          "date": {
            "type": "string",
            "format": "date",
            "description": "Date the note was added (YYYY-MM-DD)."
          }
        }
      }
    },
    "sources": {
      "type": "array",
      "items": {
        "type": "string",
        "format": "uri"
      },
      "description": "Official spec page / datasheet URLs."
    },
    "last_verified": {
      "type": "string",
      "format": "date",
      "description": "Date (YYYY-MM-DD) this entry's spec was last checked against its sources[] and confirmed accurate."
    },
    "configs": {
      "type": "object",
      "description": "Community-contributed integration configs.",
      "additionalProperties": false,
      "properties": {
        "frigate": {
          "type": "object",
          "description": "Frigate NVR configuration snippet.",
          "additionalProperties": false,
          "properties": {
            "detect": {
              "type": "object",
              "properties": {
                "width": {
                  "type": "integer"
                },
                "height": {
                  "type": "integer"
                },
                "fps": {
                  "type": "integer"
                }
              }
            },
            "rtsp_url_template": {
              "type": "string",
              "description": "RTSP URL pattern, e.g. rtsp://{user}:{pass}@{ip}:554/h264Preview_01_main"
            },
            "best_substream": {
              "type": "string",
              "description": "Recommended sub-stream RTSP URL for Frigate's detect role (the URL to use). Distinct from video.streams[], which describes stream capabilities."
            },
            "notes": {
              "type": "string"
            },
            "verified": {
              "type": "boolean",
              "description": "Whether this configuration has been verified working with Frigate."
            },
            "tested_by": {
              "type": "string",
              "description": "The community member or source that verified the config."
            },
            "tested_version": {
              "type": "string",
              "description": "Frigate version tested (e.g. '0.14')."
            },
            "recommended_stream_type": {
              "type": "string",
              "enum": ["go2rtc", "ffmpeg", "rtsp"],
              "description": "Recommended stream input type (e.g. go2rtc for WebRTC/audio, ffmpeg for scaling, native rtsp)."
            },
            "autotracking": {
              "type": "boolean",
              "description": "Whether Frigate can drive PTZ autotracking on this camera. Requires ONVIF relative movement (ptz.onvif_ptz: relative); false for absolute-only cameras like Reolink. Distinct from camera-side ptz.autotracking."
            },
            "onvif_port": {
              "type": "integer",
              "description": "ONVIF control port for Frigate's onvif: block (manual PTZ / autotracking). 80 on most ONVIF cameras (ONVIF runs on the HTTP service port); non-default on some brands (Tapo 2020, Reolink 8000). Set from the datasheet or the brand's ONVIF documentation; only populated on ONVIF-capable cameras."
            },
            "two_way_audio": {
              "type": "boolean",
              "description": "Whether two-way audio (Frigate live-view talk, via the go2rtc backchannel) is available. Set true only when the datasheet confirms two-way audio AND the camera exposes ONVIF/RTSP. The exact backchannel method (go2rtc tapo://, RTSP #backchannel=1, ONVIF) is documented once in the Frigate guide rather than per camera."
            }
          }
        },
        "home_assistant": {
          "type": "object",
          "description": "Home Assistant integration notes.",
          "properties": {
            "integration": {
              "type": "string",
              "description": "e.g. 'onvif', 'reolink', 'frigate'"
            },
            "notes": {
              "type": "string"
            },
            "connection_type": {
              "type": "string",
              "enum": ["local", "local_push", "local_poll", "cloud", "cloud_push", "cloud_poll"],
              "description": "Integration connectivity type."
            },
            "doorbell_button": {
              "type": "boolean",
              "description": "Whether the doorbell button press event is exposed."
            },
            "two_way_audio": {
              "type": "boolean",
              "description": "Whether two-way audio is supported in Home Assistant."
            },
            "onvif_events": {
              "type": "boolean",
              "description": "Whether ONVIF motion or other events are supported."
            }
          }
        },
        "blue_iris": {
          "type": "object",
          "description": "Blue Iris configuration notes.",
          "properties": {
            "profile": {
              "type": "string",
              "description": "Camera type profile in Blue Iris."
            },
            "notes": {
              "type": "string"
            }
          }
        }
      }
    },
    "status": {
      "type": "string",
      "enum": [
        "available",
        "announced",
        "discontinued"
      ],
      "description": "Product availability status."
    },
    "network": {
      "type": "object",
      "additionalProperties": false,
      "description": "Wired network interface details from the datasheet (Ethernet / RJ45 row).",
      "properties": {
        "ethernet_speed_mbps": {
          "type": "integer",
          "enum": [
            10,
            100,
            1000,
            2500,
            10000
          ],
          "description": "Max link speed of the RJ45 port as stated in the datasheet (e.g. '10M/100M self-adaptive' = 100)."
        },
        "ethernet_ports": {
          "type": "integer",
          "minimum": 1
        }
      }
    }
  }
}
