{
  "id": "tvt-td-9584s4-d",
  "brand": "TVT Digital",
  "model": "TD-9584S4-D",
  "type": "turret",
  "resolution": {
    "megapixels": 8
  },
  "lens": {
    "varifocal": false,
    "count": 1
  },
  "night_vision": {
    "type": "hybrid"
  },
  "connectivity": [
    "ethernet"
  ],
  "power_source": [
    "poe",
    "dc"
  ],
  "protocols": [
    "rtsp"
  ],
  "storage": {
    "onboard": false,
    "nvr_compatible": true
  },
  "environment": [
    "indoor"
  ],
  "features": [
    "8MP Dual Illumination Water-proof Turret Network Camera"
  ],
  "markets": [
    "global"
  ],
  "cloud_dependency": "local",
  "sources": [
    "https://en.tvt.net.cn/products/1986.html",
    "https://en.tvt.net.cn/file/other/b1726458850ed3ea1b8f0e439dc450ec.pdf",
    "https://www.manualslib.com/manual/2558336/Tvt-Digital-Td-5422e1.html?page=58"
  ],
  "last_verified": "2026-10-01",
  "configs": {
    "frigate": {
      "rtsp_url_template": "rtsp://{user}:{pass}@{ip}:554/profile1",
      "best_substream": "rtsp://{user}:{pass}@{ip}:554/profile2",
      "onvif_port": 80,
      "verified": false,
      "notes": "TVT IP camera — ONVIF + TVT /profile1 (main) /profile2 (sub) RTSP path."
    },
    "home_assistant": {
      "integration": "onvif"
    },
    "blue_iris": {
      "profile": "TVT/Generic ONVIF"
    }
  }
}
