{
  "id": "360-vision-invictus",
  "brand": "360 Vision Technology",
  "model": "Invictus",
  "aliases": [
    "Invictus 32x",
    "Invictus 23x",
    "INVHD3"
  ],
  "type": "ptz",
  "connectivity": [
    "ethernet"
  ],
  "power_source": [
    "poe",
    "dc"
  ],
  "resolution": {
    "megapixels": 2,
    "max_width": 1920,
    "max_height": 1080,
    "label": "1080p HD"
  },
  "sensor": "1/2.8\" Sony Exmor R CMOS",
  "lens": {
    "count": 1,
    "varifocal": true
  },
  "field_of_view_deg": "66.45 (wide) to 3.26 (tele)",
  "night_vision": {
    "type": "hybrid",
    "range_m": 200
  },
  "video": {
    "codecs": [
      "H.264",
      "H.265",
      "MJPEG"
    ],
    "max_fps": 60
  },
  "ptz": {},
  "power": {
    "method": "DC / PoE (90W option)",
    "consumption_w": 48
  },
  "storage": {
    "onboard": true,
    "nvr_compatible": true,
    "notes": "Optional internal JPEG frame recording up to 256GB"
  },
  "protocols": [
    "onvif",
    "rtsp",
    "http"
  ],
  "ip_rating": "IP67",
  "ik_rating": "IK10",
  "environment": [
    "outdoor"
  ],
  "weight_g": 8200,
  "features": [
    "Ruggedised UK-built mid-range ball PTZ, choice of 23x or 32x optical zoom (plus 12x digital)",
    "Sony Exmor R 1/2.8\" low-light sensor, multi-stream 1080p HD up to 60ips",
    "Optional IR to c200m or IR & white light to c140m; integral wiper",
    "Hybrid model offers 1080p HD + analogue video with RS485 control for legacy systems",
    "Low-power mode (idle 12W, full load 48W), PoE 90W option, Attack Detect",
    "ONVIF (S), RTSP, 360SDK; IP67 / IK10"
  ],
  "network": {
    "ethernet_speed_mbps": 100,
    "ethernet_ports": 1
  },
  "configs": {
    "frigate": {
      "onvif_port": 80,
      "verified": false,
      "notes": "ONVIF Profile S PTZ; enable ONVIF and set a dedicated user."
    },
    "home_assistant": {
      "integration": "onvif",
      "notes": "ONVIF (360 Vision Invictus)."
    },
    "blue_iris": {
      "profile": "ONVIF",
      "notes": "ONVIF/RTSP PTZ."
    }
  },
  "sources": [
    "https://www.360visiontechnology.com/invictus/",
    "https://www.360visiontechnology.com/wp-content/uploads/dlm_uploads/2025/09/360-Vision_Invictus_Range_Brochure.pdf"
  ],
  "last_verified": "2026-09-28",
  "markets": [
    "gb",
    "global"
  ],
  "cloud_dependency": "local"
}
