{
  "id": "provision-isr-i6-340lprn-mvf2",
  "brand": "Provision-ISR",
  "model": "I6-340LPRN-MVF2",
  "type": "bullet",
  "connectivity": [
    "ethernet"
  ],
  "resolution": {
    "megapixels": 4,
    "max_width": 2560,
    "max_height": 1440,
    "label": "4MP"
  },
  "lens": {
    "focal_length_mm": "7-22",
    "varifocal": true
  },
  "field_of_view_deg": "41-15",
  "video": {
    "codecs": [
      "H.265",
      "H.265+"
    ],
    "max_fps": 30
  },
  "night_vision": {
    "type": "ir",
    "range_m": 60
  },
  "audio": {
    "microphone": true,
    "speaker": true,
    "two_way": true
  },
  "storage": {
    "onboard": true,
    "nvr_compatible": true,
    "max_microsd_gb": 128
  },
  "protocols": [
    "rtsp",
    "onvif"
  ],
  "ip_rating": "IP67",
  "environment": [
    "outdoor"
  ],
  "features": [
    "License plate recognition (LPR)",
    "Wiegand output",
    "True WDR",
    "3D-DNR",
    "BLC",
    "HLC",
    "ROI",
    "Privacy mask",
    "Motion detection",
    "microSD up to 128GB"
  ],
  "power_source": [
    "poe",
    "dc"
  ],
  "sources": [
    "https://www.provision-isr.com/"
  ],
  "last_verified": "2026-09-01",
  "configs": {
    "frigate": {
      "detect": {
        "width": 640,
        "height": 480,
        "fps": 5
      },
      "rtsp_url_template": "rtsp://{user}:{pass}@{ip}:554/MediaInput/h264/stream_1",
      "best_substream": "rtsp://{user}:{pass}@{ip}:554/MediaInput/h264/stream_2",
      "onvif_port": 80,
      "two_way_audio": true,
      "notes": "Provision-ISR RTSP path is /MediaInput/h264/stream_1 (main) and stream_2 (sub); confirm in the camera web UI."
    },
    "home_assistant": {
      "integration": "onvif",
      "notes": "Add via ONVIF (port 80)."
    },
    "blue_iris": {
      "profile": "ONVIF",
      "notes": "ONVIF or the Provision RTSP URL."
    }
  },
  "markets": [
    "global"
  ]
}
