{
  "id": "uniview-ipc2d4i-wh-apf40-g-dt",
  "brand": "Uniview",
  "model": "IPC2D4I-WH-APF40-G-DT",
  "type": "bullet",
  "connectivity": [
    "ethernet"
  ],
  "power_source": [
    "poe"
  ],
  "resolution": {
    "megapixels": 4,
    "max_width": 2560,
    "max_height": 1440,
    "label": "4MP (2560x1440)"
  },
  "video": {
    "codecs": [
      "Ultra265",
      "H.265"
    ],
    "streams": [
      {
        "name": "main",
        "resolution": "2560x1440",
        "codec": "H.265"
      }
    ]
  },
  "sensor": "1/1.8\" CMOS",
  "night_vision": {
    "type": "color"
  },
  "protocols": [
    "onvif",
    "rtsp"
  ],
  "ip_rating": "IP67",
  "audio": {
    "microphone": true
  },
  "environment": [
    "outdoor"
  ],
  "features": [
    "4MP target-capture full-color bullet network camera",
    "1/1.8\" starlight large sensor, large-aperture lens, 6 warm LEDs, 24/7 color",
    "120 dB optical WDR; deep perimeter (line-cross/enter/leave/intrusion)",
    "motor-vehicle / non-motor-vehicle / pedestrian classification",
    "Ultra265, three-stream, AAC-LC audio, optional PoE, ONVIF; IP67, -30C to 60C"
  ],
  "operating_temp_c": "-30C to 60C",
  "storage": {
    "nvr_compatible": true
  },
  "configs": {
    "frigate": {
      "rtsp_url_template": "rtsp://{user}:{pass}@{ip}:554/media/video1",
      "best_substream": "rtsp://{user}:{pass}@{ip}:554/media/video2",
      "onvif_port": 80,
      "verified": false,
      "notes": "Uniview IP camera — ONVIF + Uniview /media/videoN RTSP path (video1 main, video2 sub); enable ONVIF and create a dedicated user."
    },
    "home_assistant": {
      "integration": "onvif",
      "notes": "ONVIF (Uniview)."
    },
    "blue_iris": {
      "profile": "Uniview",
      "notes": "Uniview RTSP/ONVIF."
    }
  },
  "sources": [
    "https://cn.uniview.com/Products/Cameras/Fixed-camera/Full-color/IPC2D4I-WH-APF40-G-DT/"
  ],
  "last_verified": "2026-09-22",
  "ndaa_compliant": true,
  "markets": [
    "cn"
  ],
  "cloud_dependency": "local"
}
