{
  "id": "sunell-sn-ipr8084bzan-vz",
  "brand": "Sunell",
  "model": "SN-IPR8084BZAN-VZ",
  "type": "bullet",
  "resolution": {
    "megapixels": 8,
    "max_width": 3840,
    "max_height": 2160,
    "label": "8MP (3840x2160)"
  },
  "connectivity": [
    "ethernet"
  ],
  "power_source": [
    "poe",
    "dc"
  ],
  "sensor": "1/1.8” Progressive Scan CMOS",
  "lens": {
    "focal_length_mm": "3.6-11",
    "varifocal": true,
    "aperture": "F1.3"
  },
  "field_of_view_deg": "H: 112.6 to 47.9, V: 58.2 to 26.8",
  "night_vision": {
    "type": "ir",
    "range_m": 50,
    "min_lux_color": 0.003,
    "min_lux": 0.0008
  },
  "video": {
    "max_fps": 30,
    "streams": [
      {
        "name": "main",
        "resolution": "3840x2160",
        "fps": 30
      }
    ]
  },
  "protocols": [
    "onvif",
    "rtsp",
    "http"
  ],
  "power": {
    "method": "12 VDC (-10% to +25%) / PoE (802.3af)",
    "voltage": "12 VDC",
    "consumption_w": 9.5
  },
  "storage": {
    "onboard": true,
    "nvr_compatible": true,
    "max_microsd_gb": 1024
  },
  "ip_rating": "IP67",
  "environment": [
    "outdoor"
  ],
  "operating_temp_c": "-40 to 60",
  "dimensions_mm": "232 × 80 × 80 mm",
  "weight_g": 790,
  "features": [
    "True WDR (120dB)",
    "AI detection: face, human, vehicle"
  ],
  "ndaa_compliant": true,
  "configs": {
    "frigate": {
      "detect": {
        "width": 640,
        "height": 360,
        "fps": 5
      },
      "rtsp_url_template": "rtsp://{user}:{pass}@{ip}:554/snl/live/1/1",
      "best_substream": "rtsp://{user}:{pass}@{ip}:554/snl/live/1/2",
      "onvif_port": 80,
      "verified": false,
      "notes": "Sunell IP camera — ONVIF (Profile S/T/G/M) + /snl/live RTSP path. Enable ONVIF and set a dedicated user."
    },
    "home_assistant": {
      "integration": "onvif",
      "notes": "Use the ONVIF integration (Profile S/T)."
    },
    "blue_iris": {
      "profile": "Generic/ONVIF",
      "notes": "Add as a Generic/ONVIF camera; RTSP auto-discovered via ONVIF."
    }
  },
  "sources": [
    "https://www.sunellsecurity.com/products/ultra-low-light-ip-camera/8mp-sn-ipr8084bzan-vz.shtml"
  ],
  "last_verified": "2026-09-22",
  "markets": [
    "global"
  ],
  "cloud_dependency": "local"
}
