{
  "id": "lts-vsip8342w-28mda",
  "brand": "LTS",
  "model": "VSIP8342W-28MDA",
  "aliases": [
    "VSIP8342W-28MDA"
  ],
  "type": "bullet",
  "connectivity": [
    "ethernet"
  ],
  "resolution": {
    "megapixels": 4,
    "max_width": 2688,
    "max_height": 1520,
    "label": "4MP"
  },
  "sensor": "1/3\" progressive scan CMOS",
  "lens": {
    "count": 1,
    "focal_length_mm": "2.8",
    "varifocal": false
  },
  "night_vision": {
    "type": "ir",
    "range_m": 50
  },
  "video": {
    "codecs": [
      "Ultra265",
      "H.265",
      "H.264",
      "MJPEG"
    ],
    "max_fps": 30,
    "streams": [
      {
        "name": "main",
        "resolution": "2688x1520",
        "fps": 30,
        "codec": "H.265"
      }
    ]
  },
  "power": {
    "method": "DC12V / PoE"
  },
  "power_source": [
    "poe",
    "dc"
  ],
  "storage": {
    "onboard": true,
    "max_microsd_gb": 256,
    "nvr_compatible": true
  },
  "audio": {
    "microphone": true
  },
  "ip_rating": "IP67",
  "environment": [
    "outdoor"
  ],
  "features": [
    "120dB true WDR",
    "9:16 corridor mode support",
    "Built-in microphone",
    "Smart IR up to 50m (164ft)",
    "3-axis mounting",
    "MD 2.0 with human and vehicle detection"
  ],
  "sources": [
    "https://ltsecurityinc.com/default/vsip8342w-28mda-4mp-hd-mini-ir-fixed-bullet-network-camera.html"
  ],
  "last_verified": "2026-09-20",
  "markets": [
    "global"
  ],
  "cloud_dependency": "local",
  "configs": {
    "frigate": {
      "rtsp_url_template": "rtsp://{user}:{pass}@{ip}:554/unicast/c1/s0/live",
      "best_substream": "rtsp://{user}:{pass}@{ip}:554/unicast/c1/s1/live",
      "onvif_port": 80,
      "verified": false,
      "notes": "LTS Vantage line = Uniview-OEM (Ultra265). ONVIF Profile S + the Uniview /unicast/c1/s0/live RTSP convention typically apply; not independently confirmed for this exact model — verify via the camera web UI / ONVIF discovery."
    },
    "home_assistant": {
      "integration": "onvif",
      "connection_type": "local",
      "notes": "Uniview-OEM; ONVIF Profile S/G. Enable ONVIF and add a dedicated ONVIF user."
    },
    "blue_iris": {
      "profile": "Generic/ONVIF",
      "notes": "Uniview-OEM (Ultra265); connect via ONVIF/RTSP."
    }
  },
  "protocols": [
    "rtsp"
  ]
}
