{
  "id": "acti-a210",
  "brand": "ACTi",
  "model": "A210",
  "ndaa_compliant": false,
  "type": "box",
  "connectivity": [
    "ethernet"
  ],
  "resolution": {
    "megapixels": 8,
    "max_width": 3840,
    "max_height": 2160,
    "label": "8MP"
  },
  "sensor": "1/1.8\" Progressive Scan CMOS",
  "lens": {
    "count": 1,
    "focal_length_mm": "6.4-138.5 (zoom)",
    "aperture": "F1.5",
    "varifocal": true
  },
  "field_of_view_deg": "64 horizontal / 37 vertical",
  "night_vision": {
    "type": "color",
    "min_lux_color": 0.04
  },
  "video": {
    "codecs": [
      "H.265",
      "H.264",
      "MJPEG"
    ],
    "max_fps": 30,
    "streams": [
      {
        "name": "main",
        "resolution": "3840x2160",
        "fps": 30,
        "codec": "H.265"
      }
    ]
  },
  "power": {
    "method": "DC 12V, AC 24V, PoE Class 3 (IEEE802.3af)",
    "consumption_w": 13.68,
    "poe_class": 3,
    "voltage": "DC 12V / AC 24V"
  },
  "power_source": [
    "poe",
    "dc"
  ],
  "network": {
    "ethernet_ports": 1
  },
  "audio": {
    "microphone": false,
    "speaker": false,
    "two_way": true
  },
  "environment": [
    "indoor"
  ],
  "features": [
    "Extreme WDR",
    "built-in analytics: Object Based Motion Detection, Tampering Detection",
    "ONVIF Compliant: Yes, Profile G, Profile Q",
    "1 x RS-485",
    "ONVIF confirmed, but no RTSP listed in Network Protocol & Service row -- protocols left unconfirmed"
  ],
  "operating_temp_c": "-30 to 55",
  "dimensions_mm": "133.4 x 90 x 68",
  "weight_g": 645,
  "sources": [
    "https://www.acti.com/product/A210?tab=specifications"
  ],
  "last_verified": "2026-10-01",
  "markets": [
    "global"
  ],
  "cloud_dependency": "local"
}
