{
  "id": "levelone-fcs-4051",
  "brand": "LevelOne",
  "model": "FCS-4051",
  "aliases": [
    "FCS-4051"
  ],
  "type": "ptz",
  "connectivity": [
    "ethernet"
  ],
  "power_source": [
    "poe"
  ],
  "resolution": {
    "megapixels": 2,
    "max_width": 1920,
    "max_height": 1080,
    "label": "2MP (1920x1080)"
  },
  "sensor": "1/2.8\" Progressive Scan CMOS",
  "lens": {
    "count": 1,
    "focal_length_mm": "4.8-120",
    "aperture": "F1.6",
    "varifocal": true
  },
  "field_of_view_deg": "57.6-2.5 H / 34.4-1.4 V / 64.5-2.9 D",
  "night_vision": {
    "type": "ir",
    "range_m": 100,
    "min_lux_color": 0.005,
    "min_lux": 0.001
  },
  "video": {
    "codecs": [
      "H.265",
      "H.264",
      "MJPEG"
    ],
    "max_fps": 30,
    "streams": [
      {
        "name": "main",
        "resolution": "1920x1080",
        "fps": 30,
        "codec": "H.265"
      },
      {
        "name": "sub",
        "resolution": "704x576",
        "fps": 25,
        "codec": "H.265"
      },
      {
        "name": "third",
        "resolution": "1920x1080",
        "fps": 25,
        "codec": "H.265"
      }
    ]
  },
  "power": {
    "method": "PoE",
    "consumption_w": 24
  },
  "protocols": [
    "onvif",
    "rtsp"
  ],
  "storage": {
    "onboard": true,
    "nvr_compatible": true,
    "max_microsd_gb": 256
  },
  "ip_rating": "IP66",
  "environment": [
    "indoor",
    "outdoor"
  ],
  "audio": {
    "microphone": true,
    "speaker": false,
    "two_way": true
  },
  "features": [
    "25x optical zoom PTZ",
    "Auto-tracking",
    "Face detection (up to 5)",
    "Line-crossing, intrusion & region entrance/exit",
    "Human & vehicle detection"
  ],
  "markets": [
    "global"
  ],
  "status": "available",
  "cloud_dependency": "local",
  "last_verified": "2026-09-22",
  "sources": [
    "https://www.level1.com/level1_en/fcs-4051-gemini-ptz-ip-camera-2-mp-25x-zoom-h-265-ir-100m-57303007201"
  ],
  "configs": {
    "frigate": {
      "recommended_stream_type": "go2rtc",
      "onvif_port": 80,
      "verified": false,
      "notes": "LevelOne ONVIF camera — use go2rtc ONVIF autodiscovery (onvif://{user}:{pass}@{ip}) to resolve the RTSP stream."
    },
    "home_assistant": {
      "integration": "onvif",
      "notes": "Generic ONVIF."
    },
    "blue_iris": {
      "profile": "Generic/ONVIF",
      "notes": "Generic ONVIF/RTSP."
    }
  },
  "ptz": {
    "autotracking": true
  }
}
