{
  "id": "hikvision-ids-2de7232iw-a",
  "brand": "Hikvision",
  "model": "iDS-2DE7232IW-A",
  "type": "ptz",
  "connectivity": [
    "ethernet"
  ],
  "resolution": {
    "megapixels": 2,
    "label": "2MP"
  },
  "ptz": {
    "onvif_ptz": "continuous"
  },
  "operating_temp_c": "-30 to 65",
  "protocols": [
    "onvif",
    "rtsp"
  ],
  "markets": [
    "cn"
  ],
  "ndaa_compliant": false,
  "cloud_dependency": "local",
  "last_verified": "2026-09-28",
  "sources": [
    "https://www.jiankongqicai.com/chanpin/4879.html"
  ],
  "configs": {
    "frigate": {
      "rtsp_url_template": "rtsp://{user}:{pass}@{ip}:554/Streaming/Channels/101",
      "best_substream": "rtsp://{user}:{pass}@{ip}:554/Streaming/Channels/102",
      "onvif_port": 80,
      "verified": false,
      "notes": "Hikvision RTSP/ONVIF; enable ONVIF and set a dedicated user."
    },
    "home_assistant": {
      "integration": "onvif",
      "notes": "Hikvision ONVIF (default port 80)."
    },
    "blue_iris": {
      "profile": "Hikvision",
      "notes": "Select the 'Hikvision' profile."
    }
  }
}
