{
  "id": "acti-b96",
  "brand": "ACTi",
  "model": "B96",
  "ndaa_compliant": false,
  "type": "ptz",
  "connectivity": [
    "ethernet"
  ],
  "resolution": {
    "megapixels": 5,
    "max_width": 2592,
    "max_height": 1944,
    "label": "5MP"
  },
  "sensor": "1/3.2\" Progressive Scan CMOS",
  "lens": {
    "count": 1,
    "focal_length_mm": "4.9-49 (zoom)",
    "aperture": "F1.6",
    "varifocal": true
  },
  "field_of_view_deg": "49.7 horizontal / 37 vertical",
  "night_vision": {
    "type": "color",
    "min_lux_color": 0.1,
    "min_lux": 0.05
  },
  "video": {
    "codecs": [
      "H.264",
      "MJPEG"
    ],
    "max_fps": 15,
    "streams": [
      {
        "name": "main",
        "resolution": "2592x1944",
        "fps": 15,
        "codec": "H.264"
      }
    ]
  },
  "protocols": [
    "rtsp",
    "onvif"
  ],
  "power": {
    "method": "DC 12V, PoE Class 3 (IEEE802.3af)",
    "consumption_w": 12.95,
    "poe_class": 3,
    "voltage": "DC 12V"
  },
  "power_source": [
    "poe",
    "dc"
  ],
  "network": {
    "ethernet_ports": 1
  },
  "ip_rating": "IP67",
  "audio": {
    "microphone": false,
    "speaker": false,
    "two_way": true
  },
  "environment": [
    "outdoor"
  ],
  "features": [
    "Basic WDR (74 dB)",
    "ONVIF Compliant: Yes, Profile S, Profile G, Profile Q",
    "GB28181 Compliant: Yes",
    "Heater: Yes",
    "real-time clock: Yes"
  ],
  "operating_temp_c": "-20 to 50",
  "dimensions_mm": "153 (diameter) x 116",
  "weight_g": 1263,
  "ik_rating": "IK10",
  "ptz": {
    "onvif_ptz": "absolute"
  },
  "sources": [
    "https://www.acti.com/product/B96?tab=specifications",
    "https://download.acti.com/?id=26977"
  ],
  "last_verified": "2026-09-21",
  "markets": [
    "global"
  ],
  "configs": {
    "frigate": {
      "detect": {
        "width": 1280,
        "height": 720,
        "fps": 5
      },
      "rtsp_url_template": "rtsp://{user}:{pass}@{ip}:7070/stream1",
      "onvif_port": 80,
      "two_way_audio": true
    },
    "home_assistant": {
      "integration": "onvif",
      "notes": "Use ONVIF integration. RTSP port is 7070 by default."
    },
    "blue_iris": {
      "profile": "ACTi",
      "notes": "Select 'ACTi' profile. Default RTSP port is 7070."
    }
  },
  "cloud_dependency": "local"
}
