{
  "id": "avycon-avc-tcb51f28",
  "brand": "AVYCON",
  "model": "AVC-TCB51F28",
  "ndaa_compliant": true,
  "type": "bullet",
  "resolution": {
    "megapixels": 5,
    "max_width": 2592,
    "max_height": 1944,
    "label": "5MP (2592x1944)"
  },
  "video": {
    "max_fps": 20
  },
  "lens": {
    "count": 1,
    "focal_length_mm": "2.8",
    "aperture": "F1.2",
    "varifocal": false
  },
  "connectivity": [
    "coax"
  ],
  "night_vision": {
    "type": "ir",
    "range_m": 30,
    "min_lux_color": 0.05
  },
  "ip_rating": "IP67",
  "environment": [
    "outdoor"
  ],
  "power_source": [
    "dc"
  ],
  "audio": {
    "microphone": true
  },
  "features": [
    "4-in-1 switchable (HD-TVI / AHD / CVI / CVBS)",
    "InfiniteColor",
    "Smart IR",
    "Audio over coaxial"
  ],
  "sources": [
    "https://www.avycon.com/",
    "https://avyconaivo.com/shop/item.php?it_id=AVC-TCB51F28&ca_id=1030"
  ],
  "last_verified": "2026-09-01",
  "markets": [
    "us",
    "kr"
  ],
  "sensor": "1/2.7\" Progressive Scan CMOS",
  "dimensions_mm": "84.0 x 187.95"
}
