{
  "id": "acti-b81",
  "brand": "ACTi",
  "model": "B81",
  "ndaa_compliant": false,
  "type": "dome",
  "connectivity": [
    "ethernet"
  ],
  "power_source": [
    "poe",
    "dc"
  ],
  "resolution": {
    "megapixels": 5,
    "max_width": 2592,
    "max_height": 1944,
    "label": "5MP"
  },
  "sensor": "1/3.2\" Progressive Scan CMOS",
  "lens": {
    "count": 1,
    "focal_length_mm": "3.0-9 (3x optical zoom)",
    "aperture": "F1.2-F2.1",
    "varifocal": true
  },
  "field_of_view_deg": "85.7 - 30.5 horizontal",
  "night_vision": {
    "type": "ir",
    "range_m": 40,
    "min_lux_color": 0.1
  },
  "video": {
    "codecs": [
      "H.264",
      "MJPEG"
    ],
    "max_fps": 15,
    "streams": [
      {
        "name": "main",
        "resolution": "2592x1944",
        "fps": 15,
        "codec": "H.264"
      }
    ]
  },
  "protocols": [
    "rtsp",
    "onvif"
  ],
  "power": {
    "method": "DC 12V, PoE Class 3 (IEEE802.3af)",
    "consumption_w": 9.24
  },
  "network": {
    "ethernet_ports": 1
  },
  "ip_rating": "IP67",
  "ik_rating": "IK10",
  "audio": {
    "microphone": false,
    "speaker": false,
    "two_way": true
  },
  "environment": [
    "outdoor"
  ],
  "features": [
    "Basic WDR (74 dB)",
    "Day/Night with mechanical IR cut filter",
    "Adaptive IR LED x 10 (850 nm), IR working distance 40 m",
    "3x optical zoom",
    "ONVIF Compliant: Profile S, Profile G, Profile T, Profile Q",
    "PoE powered"
  ],
  "operating_temp_c": "-40 to 50",
  "dimensions_mm": "152 x 114.5 (dia x H)",
  "weight_g": 1286,
  "sources": [
    "https://www.acti.com/product/B81",
    "https://www.acti.com/product/B81?tab=specifications"
  ],
  "last_verified": "2026-09-08",
  "markets": [
    "global"
  ],
  "configs": {
    "frigate": {
      "rtsp_url_template": "rtsp://{user}:{pass}@{ip}:7070/stream1",
      "onvif_port": 80,
      "verified": false,
      "two_way_audio": true
    },
    "home_assistant": {
      "integration": "generic"
    },
    "blue_iris": {
      "profile": "ACTi"
    }
  },
  "cloud_dependency": "local"
}
