{
  "id": "d-link-dcs-935lh",
  "brand": "D-Link",
  "model": "DCS-935LH",
  "aliases": [
    "mydlink Home Monitor HD"
  ],
  "type": "box",
  "connectivity": [
    "wifi"
  ],
  "power_source": [
    "dc"
  ],
  "resolution": {
    "megapixels": 1,
    "max_width": 1280,
    "max_height": 720,
    "label": "720p"
  },
  "sensor": "1/4\" 1-megapixel progressive scan CMOS",
  "lens": {
    "count": 1,
    "focal_length_mm": "2.38",
    "aperture": "F2.4",
    "varifocal": false
  },
  "night_vision": {
    "type": "ir",
    "range_m": 5
  },
  "video": {
    "codecs": [
      "H.264",
      "MJPEG"
    ],
    "streams": [
      {
        "name": "main",
        "resolution": "1280x720",
        "codec": "H.264"
      }
    ]
  },
  "audio": {
    "microphone": true,
    "speaker": false,
    "two_way": false
  },
  "storage": {
    "onboard": true,
    "max_microsd_gb": 128,
    "cloud": true
  },
  "environment": [
    "indoor"
  ],
  "status": "discontinued",
  "end_of_sale_year": 2018,
  "end_of_support_year": 2020,
  "features": [
    "4x digital zoom",
    "Motion and sound detection",
    "E-mail notification",
    "WPS one-button Wi-Fi setup"
  ],
  "sources": [
    "https://www.dlink.com/uk/en/products/dcs-935lh-mydlink-home-monitor-hd"
  ],
  "last_verified": "2026-09-24",
  "cloud_dependency": "cloud-required"
}
