{
  "id": "i-pro-wv-s2236lga-b",
  "brand": "i-PRO",
  "model": "WV-S2236LGA-B",
  "type": "dome",
  "resolution": {
    "megapixels": 2,
    "max_width": 1920,
    "max_height": 1080,
    "label": "1080p"
  },
  "sensor": "1/2.8\" CMOS",
  "lens": {
    "focal_length_mm": "2.9-9",
    "aperture": "f/1.3-2.5",
    "varifocal": true,
    "count": 1
  },
  "field_of_view_deg": "114 (wide) - 36 (tele)",
  "video": {
    "codecs": [
      "H.265",
      "H.264",
      "MJPEG"
    ],
    "max_fps": 60
  },
  "night_vision": {
    "type": "ir",
    "range_m": 50,
    "min_lux": 0.017,
    "min_lux_color": 0.018
  },
  "audio": {
    "microphone": true,
    "speaker": true,
    "two_way": true
  },
  "storage": {
    "onboard": true,
    "max_microsd_gb": 512,
    "cloud": false,
    "nvr_compatible": true
  },
  "power": {
    "method": "PoE (IEEE 802.3af) or DC 12V",
    "consumption_w": 8.7,
    "voltage": "12 VDC",
    "poe_class": 0
  },
  "power_source": [
    "poe",
    "dc"
  ],
  "ik_rating": "IK10",
  "environment": [
    "indoor"
  ],
  "connectivity": [
    "ethernet"
  ],
  "protocols": [
    "onvif",
    "rtsp"
  ],
  "features": [
    "varifocal motorized zoom",
    "IR illumination",
    "AI analytics",
    "FIPS 140-2 Level 3 security",
    "edge AI",
    "privacy zones",
    "vandal resistant"
  ],
  "configs": {
    "frigate": {
      "rtsp_url_template": "rtsp://{user}:{pass}@{ip}:554/Src/MediaInput/stream_1",
      "best_substream": "rtsp://{user}:{pass}@{ip}:554/Src/MediaInput/stream_2",
      "detect": {
        "width": 640,
        "height": 480,
        "fps": 5
      },
      "onvif_port": 80,
      "two_way_audio": true
    }
  },
  "sources": [
    "https://i-pro.com/products_and_solutions/en/surveillance/products/wv-s2236lga-b",
    "https://i-pro.com/products_and_solutions/sites/default/files/2026-02/WV-S2236LGA-B_i-PRO_A4_R9_260224.pdf"
  ],
  "last_verified": "2026-09-01",
  "markets": [
    "global"
  ],
  "ndaa_compliant": true,
  "weight_g": 570,
  "dimensions_mm": "ø129.5 x 102.5",
  "operating_temp_c": "-10 to 50",
  "cloud_dependency": "local"
}
