{
  "id": "sd9364-eh",
  "brand": "Vivotek",
  "model": "SD9364-EH",
  "type": "ptz",
  "connectivity": [
    "ethernet"
  ],
  "power_source": [
    "poe",
    "dc"
  ],
  "resolution": {
    "megapixels": 2,
    "max_width": 1920,
    "max_height": 1080,
    "label": "2MP (1920x1080)"
  },
  "video": {
    "codecs": [
      "H.265",
      "H.264",
      "MJPEG"
    ],
    "max_fps": 60,
    "streams": [
      {
        "name": "main",
        "resolution": "1920x1080",
        "fps": 60,
        "codec": "H.265"
      }
    ]
  },
  "sensor": "1/2.8\" Progressive CMOS",
  "lens": {
    "count": 1,
    "focal_length_mm": "4.3-129",
    "aperture": "F1.6-F4.7",
    "varifocal": true
  },
  "field_of_view_deg": "2.3-63.7 H / 1.3-38.5 V / 2.6-70.9 D",
  "night_vision": {
    "type": "ir",
    "range_m": 250,
    "min_lux": 0.001,
    "min_lux_color": 0.07
  },
  "ptz": {
    "autotracking": true
  },
  "power": {
    "method": "DC 48V / 95W PoH-PoE",
    "consumption_w": 27
  },
  "storage": {
    "onboard": true,
    "nvr_compatible": true
  },
  "protocols": [
    "onvif",
    "rtsp",
    "http"
  ],
  "audio": {
    "microphone": true,
    "speaker": true,
    "two_way": true
  },
  "features": [
    "2MP H.265 speed dome, 60 fps @ 1920x1080, 30x optical zoom (4.3-129 mm)",
    "250 m VAIR (Vari-Angle IR), 360 continuous pan, 220 tilt, auto-tracking",
    "WDR Pro (120 dB), Smart Stream II, defog, EIS, 3D privacy masks",
    "IP66 weather-proof, IK10 vandal-proof and NEMA 4X housing, -50 to 55 C",
    "DC 48V / 95W PoH-PoE, Gigabit Ethernet, RS-485 (PelcoD), SD storage, ONVIF"
  ],
  "operating_temp_c": "-50°C ~ 55°C",
  "dimensions_mm": "Ø204 x 285 mm",
  "weight_g": 6030,
  "ip_rating": "IP66",
  "ik_rating": "IK10",
  "environment": [
    "outdoor"
  ],
  "network": {
    "ethernet_speed_mbps": 1000,
    "ethernet_ports": 1
  },
  "status": "discontinued",
  "cloud_dependency": "local",
  "last_verified": "2026-09-22",
  "sources": [
    "https://web.archive.org/web/20161023035834id_/http://download.vivotek.com:80/downloadfile/downloads/datasheets/sd9364-ehdatasheet_en.pdf"
  ],
  "configs": {
    "frigate": {
      "rtsp_url_template": "rtsp://{user}:{pass}@{ip}:554/live.sdp",
      "best_substream": "rtsp://{user}:{pass}@{ip}:554/live2.sdp",
      "onvif_port": 80,
      "verified": false,
      "notes": "VIVOTEK IP camera — ONVIF + RTSP (live.sdp / liveN.sdp). Enable a dedicated ONVIF/stream account."
    },
    "home_assistant": {
      "integration": "onvif",
      "notes": "ONVIF (VIVOTEK)."
    },
    "blue_iris": {
      "profile": "Vivotek",
      "notes": "VIVOTEK RTSP/ONVIF."
    }
  }
}
