{
  "id": "axis-q6055-s",
  "brand": "Axis",
  "model": "Q6055-S",
  "type": "ptz",
  "connectivity": [
    "ethernet"
  ],
  "resolution": {
    "megapixels": 2,
    "max_width": 1920,
    "max_height": 1080,
    "label": "1080p"
  },
  "sensor": "1/2.8\" progressive scan CMOS",
  "lens": {
    "count": 1,
    "focal_length_mm": "4.44-142.6",
    "varifocal": true,
    "aperture": "F1.6-4.41"
  },
  "field_of_view_deg": "62.8-2.23 horizontal / 36.8-1.3 vertical",
  "night_vision": {
    "min_lux_color": 0.3
  },
  "video": {
    "codecs": [
      "H.264",
      "MJPEG"
    ],
    "max_fps": 50,
    "streams": [
      {
        "name": "main",
        "resolution": "1920x1080",
        "fps": 50,
        "codec": "H.264"
      }
    ]
  },
  "power": {
    "consumption_w": 4,
    "voltage": "24 VDC"
  },
  "protocols": [
    "onvif",
    "rtsp"
  ],
  "storage": {
    "onboard": false,
    "nvr_compatible": true,
    "cloud": false
  },
  "audio": {
    "microphone": false,
    "speaker": false,
    "two_way": false
  },
  "ip_rating": "IP67",
  "ik_rating": "IK10",
  "environment": [
    "outdoor"
  ],
  "operating_temp_c": "-30 to 50",
  "dimensions_mm": "150 x 100 x 30",
  "weight_g": 6000,
  "network": {
    "ethernet_speed_mbps": 100
  },
  "features": [
    "Axis Zipstream",
    "Autotracking"
  ],
  "ptz": {
    "autotracking": true
  },
  "sources": [
    "https://www.axis.com/products/axis-q6055-s",
    "https://www.axis.com/dam/public/e6/fe/50/datasheet-axis-q6055-s-ptz-network-camera-en-US-359691.pdf"
  ],
  "last_verified": "2026-09-21",
  "markets": [
    "global"
  ],
  "ndaa_compliant": true,
  "cloud_dependency": "local",
  "configs": {
    "frigate": {
      "detect": {
        "width": 640,
        "height": 480,
        "fps": 5
      },
      "rtsp_url_template": "rtsp://{user}:{pass}@{ip}/axis-media/media.amp",
      "onvif_port": 80,
      "verified": false
    },
    "home_assistant": {
      "integration": "axis",
      "notes": "Native Axis integration with auto-discovery via Zeroconf."
    },
    "blue_iris": {
      "profile": "Axis",
      "notes": "Select 'Axis' profile. Auto-discovery via ONVIF usually works."
    }
  }
}
